<?xml version="1.0" encoding="utf-8"  ?>
<?xml-stylesheet type="text/xsl" href="../xslt/Learning.xsl"?>
<Learning guid="d21a1287-1be0-41ba-9b8c-0cdc01764fd4" cost="false" offerLimited="false" xmlns:xsi="http://www.w3.org/2001/XMLSchema-instance" xsi:schemaLocation="http://www.w3schools.com ../xsd/Learning.xsd">
  <Title>UML Tutorial (Englisch)</Title>
  <Description>
	Webseite zum lernen des "unified modeling language" - bereitgestellt von "tutorialspoint". Hier werden Sie lernen wof√ºr UML gedacht ist und wie man diese Sprache einsetzt.
	Dieses Tutorial ist auf englisch.
  </Description>
  <Source type="website">
    <URI embedded="false" src="http://www.tutorialspoint.com/uml/"/>
    <Author>Mohtashim M.</Author>
    <Copyright>Tutorialspoint (2017)</Copyright>
    <Stand>2015</Stand>
    <!-- Optional ab hier -->
    <Thumbnail src="https://www.tutorialspoint.com/green/images/logo.png"/>
    <!--  Optional Ende -->
  </Source>
  <MetaInformation>
    <Class>BWL</Class>
    <!-- Optional ab hier -->
    <Professor>Prof. Bendl</Professor>
    <!--  Optional Ende -->
  </MetaInformation>
</Learning>