<?xml version="1.0" encoding="utf-8"  ?>
<?xml-stylesheet type="text/xsl" href="../xslt/Learning.xsl"?>
<Learning guid="750576dd-7e5b-437f-87e8-87bbe2359145" cost="false" offerLimited="false" xmlns:xsi="http://www.w3.org/2001/XMLSchema-instance" xsi:schemaLocation="http://www.w3schools.com ../xsd/Learning.xsd">
  <Title>OpenHPI</Title>
  <Description>
MOOCs – Massive Open Online Courses – bieten eine der innovativsten Lernformen: Frei über das Internet können Lernende auf didaktisch aufbereitete multimediale Kursmaterialien zugreifen und vermittels Social Media im engen Austausch mit den anderen Kursteilnehmern lernen. Wer sich mit solchen MOOCs im Bereich der sich rasant entwickelnden Informationstechnologien aus- und weiterbilden will, ist bei open HPI, der MOOC-Plattform des Hasso-Plattner-Instituts genau richtig!
	
  </Description>
  <Source type="website">
    <URI embedded="false" src="https://open.hpi.de/"/>
    <Author>Prof. Dr. Christoph Meinel</Author>
    <Copyright>Hasso-Plattner-Institut</Copyright>
    <Stand>2017</Stand>
	
    <!-- Optional ab hier -->
    <Thumbnail src="https://pbs.twimg.com/profile_images/378800000827898552/669f90369b095789252ae6f0649bc39a_400x400.png"/>
    <!--  Optional Ende -->
  </Source>
  <MetaInformation>
    <Class>All</Class>
    <!-- Optional ab hier -->
    <Professor>-</Professor>
    <!--  Optional Ende -->
  </MetaInformation>
</Learning>