<?xml version="1.0" encoding="utf-8"  ?>
<?xml-stylesheet type="text/xsl" href="../xslt/Learning.xsl"?>
<Learning guid="c5aa8c91-165b-42f7-afb2-70eaffb8329a " cost="false" offerLimited="false" xmlns:xsi="http://www.w3.org/2001/XMLSchema-instance" xsi:schemaLocation="http://www.w3schools.com ../xsd/Learning.xsd">
  <Title>Amazing SQL</Title>
  <Description>
	Amazing SQL ist eine kostenlose Software, mit der man SQL-Abfragen in verschiedenen Schwierigkeitsstufen Ã¼ben kann.
  </Description>
  <Source type="website">
    <URI embedded="false" src="http://amazing-sql.com/"/>
    <Author>Andreas Palosi und Jan Freidinger</Author>
    <Copyright>-</Copyright>
    <Stand>2017</Stand>
	
    <!-- Optional ab hier -->
    <Thumbnail src="http://amazing-sql.com/images/logo_small.png"/>
    <!--  Optional Ende -->
  </Source>
  <MetaInformation>
    <Class>Datenbanken</Class>
    <!-- Optional ab hier -->
    <Professor>Sebastian Welter</Professor>
    <!--  Optional Ende -->
  </MetaInformation>
</Learning>