<?xml version="1.0" encoding="utf-8"  ?>
<?xml-stylesheet type="text/xsl" href="../xslt/Learning.xsl"?>
<Learning guid="194f1c1b-d38a-4725-acbb-53e97ec1b2b9" cost="false" offerLimited="true" xmlns:xsi="http://www.w3.org/2001/XMLSchema-instance" xsi:schemaLocation="http://www.w3schools.com ../xsd/Learning.xsd">
  <Title>Introduction to Logic</Title>
  <Description>
	Dieser Kurs bietet einen Einstieg in die Logik im Umfeld der rechnergestützen Informationsverarbeitung
	und stellt deren Anwendungsfelder vor.
	Zu den Kompetenzen die vermittelt werden, zählt das Formulieren von logische Sätze bzw. logische Formeln
	und es wird darauf eingegegangen, wie aus dieser Darstellung von Informationen eine logische Beweisführung möglich wird.
  </Description>
  <Source type="website">
    <URI embedded="false" src="https://www.coursera.org/learn/logic-introduction"/>
    <Author>Stanford University</Author>
    <Copyright>Coursera Inc.</Copyright>
    <Stand>2017</Stand>
    <!-- Optional ab hier -->
    <Thumbnail src="https://cdn.pixabay.com/photo/2016/11/13/13/29/puzzle-1821011_1280.jpg"/>
    <!--  Optional Ende -->
  </Source>
  <MetaInformation>
    <Class>Logik und Algebra</Class>
    <!-- Optional ab hier -->
    <Professor>Prof. Dr. Schwinn</Professor>
    <!--  Optional Ende -->
  </MetaInformation>
</Learning>
