<?xml version="1.0" encoding="utf-8"  ?>
<?xml-stylesheet type="text/xsl" href="../xslt/Learning.xsl"?>
<Learning guid="ed37a874-b6a8-47aa-a81c-a2c57e7269e0" cost="false" offerLimited="false" xmlns:xsi="http://www.w3.org/2001/XMLSchema-instance" xsi:schemaLocation="http://www.w3schools.com ../xsd/Learning.xsd">
  <Title>Introduction to Economics: Macroeconomics</Title>
  <Description>
  In diesem Wirtschaftskurs lernen Sie die Hauptkonzepte der Makroekonomie, wie Bruttoinlandsprodukt, Preislevel, Inflation, Arbeitslosigkeit, wirtschaftliches Wachstum und Zahlungsbilanz. Sie werden erkennen, dass sich die Makroekonomie nicht allzu sehr von der Mikroekonomie unterscheidet, da die Interaktion von Angebot und Nachfrage das grundsätzliche Organisationsframework zum Analysieren von Tätigkeiten einer nationales Wirtschaft darstellt. Sie werden lernen, wie die Equilibrium Ebenen des nationalen Einkommens und die Preise am Schnittpunkt der Kurven des gesamtwirtschaftlichen Angebots und der gesamtwirtschaftlichen Nachfrage bestimmt werden, genauso wie die Equilibrium Menge einer Transaktion und der Preis einer einzelnen Ware am Schnittpunkt der Angebots- und Nachfragekurven bestimmt werden.
  Dies ist ein Einführungskurs auf der elementarsten Ebene, so dass keine Vorkenntnisse der Ökonomie erforderlich ist.
  </Description>
  <Source type="website">
    <URI embedded="false" src="https://www.edx.org/course/introduction-economics-macroeconomics-snux-snu044-088-2x"/>
    <Author>Seoul National University</Author>
    <Copyright>2012-2017 edX Inc.</Copyright>
    <Stand>2017</Stand>
    <!-- Optional ab hier -->
    <Thumbnail src="https://www.edx.org/sites/default/files/styles/course_video_banner/public/course/image/featured-card/macroeconomics_318x210.jpg?itok=nzshdSy-"/>
    <!--  Optional Ende -->
  </Source>
  <MetaInformation>
    <Class>VWL</Class>
    <!-- Optional ab hier -->
    <Professor>Prof. Dr. Thomas Schuster</Professor>
    <!--  Optional Ende -->
  </MetaInformation>
</Learning>
