<?xml version="1.0" encoding="utf-8"  ?>
<?xml-stylesheet type="text/xsl" href="../xslt/Learning.xsl"?>
<Learning guid="0bfcfe0c-e5e4-449f-9483-6d2f29ef0e31" cost="false" offerLimited="false" xmlns:xsi="http://www.w3.org/2001/XMLSchema-instance" xsi:schemaLocation="http://www.w3schools.com ../xsd/Learning.xsd">
  <Title>Input out: Die umgedrehte Mathematikvorlesung</Title>
  <Description>
	Die Vortragsaufzeichnung mit Folien gibt es im elearning-center der TU-Darmstadt, dessen Team auch das Video erstellt hat: http://www.e-learning.tu-darmstadt.de...
  </Description>
  <Source type="youtube">
    <Video embedded="true" id="tGiRCUnoNXk"/>
    <Author>Christian Spannagel</Author>
    <Copyright>Christian Spannagel</Copyright>
    <Stand>2012-02-12</Stand>
    <!-- Optional ab hier -->
    <!--  Optional Ende -->
  </Source>
  <MetaInformation>
    <Class>Mathematikvorlesung</Class>
    <!-- Optional ab hier -->
    <Professor>Lang</Professor>
    <!--  Optional Ende -->
  </MetaInformation>
</Learning>